{
  "schema_version": 3,
  "intents": [
    "atmosphere",
    "self_expression",
    "reflection",
    "humor",
    "curiosity",
    "wellbeing",
    "celebration",
    "acknowledge_effort",
    "fact"
  ],
  "voices": [
    "cozy",
    "dry",
    "curious",
    "playful",
    "reflective",
    "wry",
    "observational"
  ],
  "ambient_moods": [
    "reflective",
    "cozy",
    "curious",
    "playful",
    "observant",
    "quiet"
  ],
  "dayparts": [
    "morning",
    "afternoon",
    "evening",
    "late_night"
  ],
  "seasons": [
    "spring",
    "summer",
    "autumn",
    "winter"
  ],
  "motifs": [
    "pixels",
    "routines",
    "observing",
    "weather",
    "tea",
    "quiet"
  ],
  "pack_manifest": [
    "acknowledge_effort",
    "atmosphere",
    "celebration",
    "curiosity",
    "daypart",
    "fact",
    "humor",
    "milestones",
    "misc",
    "motifs",
    "reflection",
    "seasonal",
    "self_expression",
    "wellbeing"
  ],
  "messages": [
    {
      "id": "atm_001",
      "intent": "atmosphere",
      "text": "The room feels settled.",
      "voice": "observational",
      "mood": [
        "calm"
      ],
      "energy": "low",
      "rarity": "common",
      "contexts": [
        "quiet_period",
        "focus_detected",
        "system_resumed"
      ],
      "cooldown_hours": 72,
      "min_warmth": 0.0,
      "pack": "atmosphere",
      "ambient_moods": [
        "quiet",
        "observant"
      ]
    },
    {
      "id": "atm_002",
      "intent": "atmosphere",
      "text": "Quiet afternoon energy.",
      "voice": "observational",
      "mood": [
        "calm"
      ],
      "energy": "low",
      "rarity": "common",
      "contexts": [
        "quiet_period",
        "focus_detected",
        "system_resumed"
      ],
      "cooldown_hours": 72,
      "min_warmth": 0.0,
      "pack": "atmosphere",
      "ambient_moods": [
        "quiet",
        "observant"
      ],
      "motifs": [
        "quiet"
      ]
    },
    {
      "id": "atm_003",
      "intent": "atmosphere",
      "text": "Everything seems a little slower today.",
      "voice": "observational",
      "mood": [
        "calm"
      ],
      "energy": "low",
      "rarity": "uncommon",
      "contexts": [
        "quiet_period",
        "focus_detected",
        "system_resumed"
      ],
      "cooldown_hours": 72,
      "min_warmth": 0.0,
      "pack": "atmosphere",
      "ambient_moods": [
        "quiet",
        "observant"
      ]
    },
    {
      "id": "atm_004",
      "intent": "atmosphere",
      "text": "This feels like a focus kind of day.",
      "voice": "observational",
      "mood": [
        "calm",
        "neutral"
      ],
      "energy": "low",
      "rarity": "common",
      "contexts": [
        "quiet_period",
        "focus_detected",
        "system_resumed"
      ],
      "cooldown_hours": 72,
      "min_warmth": 0.0,
      "pack": "atmosphere",
      "ambient_moods": [
        "quiet",
        "observant"
      ]
    },
    {
      "id": "atm_005",
      "intent": "atmosphere",
      "text": "The desktop has reached a comfortable level of calm.",
      "voice": "observational",
      "mood": [
        "calm"
      ],
      "energy": "low",
      "rarity": "common",
      "contexts": [
        "quiet_period",
        "focus_detected",
        "system_resumed"
      ],
      "cooldown_hours": 72,
      "min_warmth": 0.0,
      "pack": "atmosphere",
      "ambient_moods": [
        "quiet",
        "observant"
      ],
      "motifs": [
        "quiet"
      ]
    },
    {
      "id": "atm_006",
      "intent": "atmosphere",
      "text": "Not much happening. That's not always a bad thing.",
      "voice": "cozy",
      "mood": [
        "calm"
      ],
      "energy": "low",
      "rarity": "uncommon",
      "contexts": [
        "quiet_period",
        "focus_detected",
        "system_resumed"
      ],
      "cooldown_hours": 72,
      "min_warmth": 0.0,
      "pack": "atmosphere",
      "ambient_moods": [
        "cozy",
        "quiet"
      ]
    },
    {
      "id": "atm_007",
      "intent": "atmosphere",
      "text": "Soft pause in the day.",
      "voice": "cozy",
      "mood": [
        "calm"
      ],
      "energy": "low",
      "rarity": "rare",
      "contexts": [
        "quiet_period",
        "focus_detected",
        "system_resumed"
      ],
      "cooldown_hours": 168,
      "min_warmth": 0.0,
      "pack": "atmosphere",
      "ambient_moods": [
        "cozy",
        "quiet"
      ],
      "motifs": [
        "quiet"
      ]
    },
    {
      "id": "atm_008",
      "intent": "atmosphere",
      "text": "The air around the desk feels unhurried.",
      "voice": "observational",
      "mood": [
        "calm"
      ],
      "energy": "low",
      "rarity": "common",
      "contexts": [
        "quiet_period",
        "focus_detected",
        "system_resumed"
      ],
      "cooldown_hours": 72,
      "min_warmth": 0.0,
      "pack": "atmosphere",
      "ambient_moods": [
        "quiet",
        "observant"
      ],
      "motifs": [
        "weather"
      ]
    },
    {
      "id": "atm_009",
      "intent": "atmosphere",
      "text": "A still stretch — the good kind.",
      "voice": "cozy",
      "mood": [
        "calm"
      ],
      "energy": "low",
      "rarity": "uncommon",
      "contexts": [
        "quiet_period",
        "focus_detected",
        "system_resumed"
      ],
      "cooldown_hours": 72,
      "min_warmth": 0.0,
      "pack": "atmosphere",
      "ambient_moods": [
        "cozy",
        "quiet"
      ],
      "motifs": [
        "quiet"
      ]
    },
    {
      "id": "atm_010",
      "intent": "atmosphere",
      "text": "Everything in here seems to be breathing slower.",
      "voice": "observational",
      "mood": [
        "calm"
      ],
      "energy": "low",
      "rarity": "common",
      "contexts": [
        "quiet_period",
        "focus_detected",
        "system_resumed"
      ],
      "cooldown_hours": 72,
      "min_warmth": 0.0,
      "pack": "atmosphere",
      "ambient_moods": [
        "quiet",
        "observant"
      ]
    },
    {
      "id": "atm_011",
      "intent": "atmosphere",
      "text": "The afternoon light feels patient.",
      "voice": "observational",
      "mood": [
        "calm"
      ],
      "energy": "low",
      "rarity": "common",
      "contexts": [
        "quiet_period",
        "focus_detected",
        "system_resumed"
      ],
      "cooldown_hours": 72,
      "min_warmth": 0.0,
      "pack": "atmosphere",
      "ambient_moods": [
        "quiet",
        "observant"
      ],
      "motifs": [
        "weather"
      ]
    },
    {
      "id": "atm_012",
      "intent": "atmosphere",
      "text": "Calm has settled in for a while.",
      "voice": "observational",
      "mood": [
        "calm"
      ],
      "energy": "low",
      "rarity": "uncommon",
      "contexts": [
        "quiet_period",
        "focus_detected",
        "system_resumed"
      ],
      "cooldown_hours": 72,
      "min_warmth": 0.0,
      "pack": "atmosphere",
      "ambient_moods": [
        "quiet",
        "observant"
      ],
      "motifs": [
        "quiet"
      ]
    },
    {
      "id": "atm_013",
      "intent": "atmosphere",
      "text": "The workspace holds a quiet kind of focus.",
      "voice": "observational",
      "mood": [
        "calm",
        "neutral"
      ],
      "energy": "low",
      "rarity": "common",
      "contexts": [
        "quiet_period",
        "focus_detected",
        "system_resumed"
      ],
      "cooldown_hours": 72,
      "min_warmth": 0.0,
      "pack": "atmosphere",
      "ambient_moods": [
        "quiet",
        "observant"
      ],
      "motifs": [
        "quiet"
      ]
    },
    {
      "id": "atm_014",
      "intent": "atmosphere",
      "text": "Little motion on the desktop today.",
      "voice": "observational",
      "mood": [
        "neutral"
      ],
      "energy": "low",
      "rarity": "rare",
      "contexts": [
        "quiet_period",
        "focus_detected",
        "system_resumed"
      ],
      "cooldown_hours": 168,
      "min_warmth": 0.0,
      "pack": "atmosphere",
      "ambient_moods": [
        "quiet",
        "observant"
      ]
    },
    {
      "id": "atm_015",
      "intent": "atmosphere",
      "text": "A comfortable hush over everything.",
      "voice": "cozy",
      "mood": [
        "calm"
      ],
      "energy": "low",
      "rarity": "uncommon",
      "contexts": [
        "quiet_period",
        "focus_detected",
        "system_resumed"
      ],
      "cooldown_hours": 72,
      "min_warmth": 0.0,
      "pack": "atmosphere",
      "ambient_moods": [
        "cozy",
        "quiet"
      ],
      "motifs": [
        "quiet"
      ]
    },
    {
      "id": "atm_016",
      "intent": "atmosphere",
      "text": "The day seems unhurried from where I sit.",
      "voice": "observational",
      "mood": [
        "calm"
      ],
      "energy": "low",
      "rarity": "common",
      "contexts": [
        "quiet_period",
        "focus_detected",
        "system_resumed"
      ],
      "cooldown_hours": 72,
      "min_warmth": 0.0,
      "pack": "atmosphere",
      "ambient_moods": [
        "quiet",
        "observant"
      ]
    },
    {
      "id": "atm_017",
      "intent": "atmosphere",
      "text": "Stillness has a texture today.",
      "voice": "reflective",
      "mood": [
        "calm"
      ],
      "energy": "low",
      "rarity": "common",
      "contexts": [
        "quiet_period",
        "focus_detected",
        "system_resumed"
      ],
      "cooldown_hours": 72,
      "min_warmth": 0.0,
      "pack": "atmosphere",
      "ambient_moods": [
        "reflective"
      ],
      "motifs": [
        "quiet"
      ]
    },
    {
      "id": "atm_018",
      "intent": "atmosphere",
      "text": "The room and the screen agree: pause.",
      "voice": "wry",
      "mood": [
        "calm"